{
  "v": 1,
  "catalogVersion": "2026.08.27.1",
  "generatedAt": "2026-08-27T20:00:00Z",
  "remotes": [
    {
      "id": "flathub",
      "repoFile": "/usr/share/punar/catalog/remotes/flathub.flatpakrepo",
      "url": "https://dl.flathub.org/repo/"
    }
  ],
  "apps": [
    {
      "id": "spotify",
      "name": "Spotify",
      "category": "media",
      "summary": "Music and podcasts while you work. The native desktop client is offered where its publisher provides Linux binaries; the web player is the ARM64 fallback.",
      "trustTier": "community",
      "license": "proprietary",
      "publisher": "flathub",
      "bundledUpdater": "disabled-by-packaging",
      "disclosures": [
        {
          "id": "publisher:community",
          "text": "The native package is maintained by the Flathub community and is not verified by, affiliated with, or supported by Spotify."
        },
        {
          "id": "platform:x86-only",
          "text": "Spotify currently publishes the Linux desktop binary only for x86_64. ARM64 devices use the official Spotify web player in Chromium."
        }
      ],
      "sources": [
        {
          "kind": "flatpak",
          "architectures": ["x86_64"],
          "remote": "flathub",
          "appId": "com.spotify.Client",
          "ref": "app/com.spotify.Client/x86_64/stable",
          "commit": "c220ff3a3fea1408ad4d5133d692eacaa1ac2399ff0d3a20a56c5292cd991f8d",
          "runtime": "org.freedesktop.Platform/x86_64/25.08",
          "metadataSha256": "23ebfd7a42327e7e3ac44e7fd548481fb4c66ce9e1535bae7f2192931f201c6f"
        },
        {
          "kind": "web",
          "architectures": ["x86_64", "aarch64"],
          "url": "https://open.spotify.com/",
          "browser": "chromium"
        }
      ]
    }
  ]
}
